{
    "$schema": "../tenant.schema.json",
    "name": "SeRP",
    "organisation": "Secure eResearch Platform",
    "images": {
        "logo": null,
        "logoAlt": "SeRP",
        "background": "background.webp"
    },
    "colours": {
        "brand": "#1B1438",
        "accent": "#4E2A6B",
        "accentDark": "#341A49",
        "tint": "#EEE8F4",
        "tint2": "#F3EFF7",
        "focus": "#3A5DA6",
        "panel": {
            "base": "#0A1236",
            "text": "#FFFFFF",
            "subtext": "rgba(255,255,255,0.86)",
            "muted": "rgba(255,255,255,0.76)",
            "scrim": "linear-gradient(100deg, rgba(8,14,46,0.85) 0%, rgba(8,14,46,0.45) 42%, rgba(8,14,46,0) 70%)"
        }
    },
    "messages": {
        "brandPanelFooter": "Secure eResearch Platform · Supported by Swansea University",
        "panel.login.headline": "Powering Secure Data Environments.",
        "panel.login.subtext": "Sign in to reach your secure research workspace, projects and data — all in one trusted environment."
    }
}
